01/08/2018,"-23.33","DRAKE SUPERMARKETS A     ASCOT PARK",""
01/08/2018,"+2000.00","PAYMENT RECEIVED, THANK YOU",""
01/08/2018,"+150.00","PAYMENT RECEIVED, THANK YOU",""
01/08/2018,"-20.00","ADELAIDE METRO           ADELAIDE",""
31/07/2018,"-105.00","NUTRIMETICS AUST         GLADESVILLE NSW",""
31/07/2018,"+200.00","PAYMENT RECEIVED, THANK YOU",""
31/07/2018,"-24.55","FLAGSTAFF HILL FOODQPS   FLAGSTAFF HI",""
31/07/2018,"-353.08","BPAYN AGL South Aust P/L PARRAMATTA",""
31/07/2018,"-67.96","COMMONWEALTH INSURANCE   SYDNEY OLYMP",""
